{
  "bootstrap_sha": "3333333333333333333333333333333333333333",
  "image": {
    "digest": "sha256:7777777777777777777777777777777777777777777777777777777777777777",
    "reference": "ghcr.io/lambdasistemi/amaru-bootstrap-producer:3333333333333333333333333333333333333333@sha256:7777777777777777777777777777777777777777777777777777777777777777",
    "repository": "ghcr.io/lambdasistemi/amaru-bootstrap-producer",
    "tag": "3333333333333333333333333333333333333333"
  },
  "publication": {
    "conclusion": "success",
    "head_sha": "3333333333333333333333333333333333333333",
    "job_id": 7602,
    "repository": "lambdasistemi/amaru-bootstrap",
    "run_attempt": 1,
    "run_id": 7601,
    "workflow": "Publish bootstrap-producer image"
  },
  "schema": "amaru-bootstrap-image-publication/v1"
}
